{
  "id": "bulkhead",
  "name": "Bulkhead Interactive",
  "aliases": [
    "BULKHEAD",
    "Bulkhead"
  ],
  "roles": [
    "developer"
  ],
  "description": {
    "source": {
      "text": "British video game developer",
      "license": "cc0",
      "source": {
        "type": "wikidata",
        "url": "https://www.wikidata.org/wiki/Q141493974",
        "retrievedAt": "2026-10-14"
      }
    },
    "custom": null
  },
  "website": "https://bulkhead.com/",
  "socialLinks": {},
  "location": {
    "headquarters": "Derby",
    "country": "GB",
    "countryName": "United Kingdom"
  },
  "founded": null,
  "foundedDate": null,
  "ownership": {
    "status": "unknown",
    "parentCompany": null,
    "parentCompanyName": null,
    "notes": null
  },
  "externalIds": {
    "wikidata": "Q141493974"
  },
  "logo": null,
  "classification": {
    "include": false,
    "category": "unclassified",
    "notes": ""
  },
  "games": {
    "developed": [
      "wardogs"
    ],
    "published": []
  },
  "statistics": {
    "gameCount": 1,
    "developedCount": 1,
    "publishedCount": 0,
    "totalSteamReviews": 116207,
    "averagePositivePercentage": 74.1,
    "weightedPositivePercentage": 74.1,
    "mostReviewedGame": "wardogs",
    "mostRecentRelease": "wardogs",
    "firstRelease": "wardogs",
    "technologyCount": 0,
    "engineCount": 0,
    "engines": []
  },
  "sources": [
    {
      "type": "wikidata",
      "url": "https://www.wikidata.org/wiki/Q141493974",
      "retrievedAt": "2026-10-14"
    }
  ],
  "lastUpdated": "2026-10-14T10:16:52.367Z"
}
