{
  "id": "mouldy-toof-studios",
  "name": "Mouldy Toof Studios",
  "aliases": [],
  "roles": [
    "developer"
  ],
  "description": {
    "source": null,
    "custom": null
  },
  "website": null,
  "socialLinks": {},
  "location": {
    "headquarters": null,
    "country": null,
    "countryName": null
  },
  "founded": null,
  "foundedDate": null,
  "ownership": {
    "status": "unknown",
    "parentCompany": null,
    "parentCompanyName": null,
    "notes": null
  },
  "externalIds": {},
  "logo": null,
  "classification": {
    "include": false,
    "category": "unclassified",
    "notes": ""
  },
  "games": {
    "developed": [
      "the-escapists",
      "the-escapists-2"
    ],
    "published": []
  },
  "statistics": {
    "gameCount": 2,
    "developedCount": 2,
    "publishedCount": 0,
    "totalSteamReviews": 50178,
    "averagePositivePercentage": 90.4,
    "weightedPositivePercentage": 90.4,
    "mostReviewedGame": "the-escapists-2",
    "mostRecentRelease": "the-escapists-2",
    "firstRelease": "the-escapists",
    "technologyCount": 1,
    "engineCount": 1,
    "engines": [
      "unity"
    ]
  },
  "sources": [],
  "lastUpdated": "2026-09-30T09:34:48.857Z"
}
