{
  "id": "gamersky-games",
  "name": "Gamersky Games",
  "aliases": [],
  "roles": [
    "publisher"
  ],
  "description": {
    "source": null,
    "custom": null
  },
  "website": null,
  "socialLinks": {},
  "location": {
    "headquarters": null,
    "country": null,
    "countryName": null
  },
  "founded": null,
  "foundedDate": null,
  "ownership": {
    "status": "unknown",
    "parentCompany": null,
    "parentCompanyName": null,
    "notes": null
  },
  "externalIds": {},
  "logo": null,
  "classification": {
    "include": false,
    "category": "unclassified",
    "notes": ""
  },
  "games": {
    "developed": [],
    "published": [
      "dwarves-glory-death-and-loot"
    ]
  },
  "statistics": {
    "gameCount": 1,
    "developedCount": 0,
    "publishedCount": 1,
    "totalSteamReviews": 2726,
    "averagePositivePercentage": 82.2,
    "weightedPositivePercentage": 82.2,
    "mostReviewedGame": "dwarves-glory-death-and-loot",
    "mostRecentRelease": "dwarves-glory-death-and-loot",
    "firstRelease": "dwarves-glory-death-and-loot",
    "technologyCount": 0,
    "engineCount": 0,
    "engines": []
  },
  "sources": [],
  "lastUpdated": "2026-09-30T10:41:54.255Z"
}
