{
  "id": "mopeful-games",
  "name": "Mopeful Games",
  "aliases": [],
  "roles": [
    "developer"
  ],
  "description": {
    "source": {
      "text": "Finnish video game developer",
      "license": "cc0",
      "source": {
        "type": "wikidata",
        "url": "https://www.wikidata.org/wiki/Q119742902",
        "retrievedAt": "2026-10-11"
      }
    },
    "custom": null
  },
  "website": null,
  "socialLinks": {},
  "location": {
    "headquarters": null,
    "country": "FI",
    "countryName": "Finland"
  },
  "founded": null,
  "foundedDate": null,
  "ownership": {
    "status": "unknown",
    "parentCompany": null,
    "parentCompanyName": null,
    "notes": null
  },
  "externalIds": {
    "wikidata": "Q119742902"
  },
  "logo": null,
  "classification": {
    "include": false,
    "category": "unclassified",
    "notes": ""
  },
  "games": {
    "developed": [
      "wardrum"
    ],
    "published": []
  },
  "statistics": {
    "gameCount": 1,
    "developedCount": 1,
    "publishedCount": 0,
    "totalSteamReviews": 101,
    "averagePositivePercentage": 85.1,
    "weightedPositivePercentage": 85.1,
    "mostReviewedGame": "wardrum",
    "mostRecentRelease": "wardrum",
    "firstRelease": "wardrum",
    "technologyCount": 0,
    "engineCount": 0,
    "engines": []
  },
  "sources": [
    {
      "type": "wikidata",
      "url": "https://www.wikidata.org/wiki/Q119742902",
      "retrievedAt": "2026-10-11"
    }
  ],
  "lastUpdated": "2026-10-11T11:26:22.704Z"
}
