{
  "id": "markus-persson",
  "name": "Markus Persson",
  "aliases": [
    "Markus Alexei",
    "Markus Alexej Persson",
    "Nizzotch",
    "Notch",
    "xNotch"
  ],
  "roles": [
    "developer"
  ],
  "description": {
    "source": {
      "text": "Swedish video game programmer and founder of Mojang (born 1979)",
      "license": "cc0",
      "source": {
        "type": "wikidata",
        "url": "https://www.wikidata.org/wiki/Q266224",
        "retrievedAt": "2026-10-22"
      }
    },
    "custom": null
  },
  "website": null,
  "socialLinks": {
    "mastodon": "https://mastodon.gamedev.place/@notch",
    "x": "https://x.com/notch"
  },
  "location": {
    "headquarters": null,
    "country": null,
    "countryName": null
  },
  "founded": null,
  "foundedDate": null,
  "ownership": {
    "status": "unknown",
    "parentCompany": null,
    "parentCompanyName": null,
    "notes": null
  },
  "externalIds": {
    "wikidata": "Q266224",
    "igdb": "markus-notch-persson"
  },
  "logo": null,
  "classification": {
    "include": false,
    "category": "unclassified",
    "notes": ""
  },
  "games": {
    "developed": [
      "0x10c"
    ],
    "published": []
  },
  "statistics": {
    "gameCount": 1,
    "developedCount": 1,
    "publishedCount": 0,
    "totalSteamReviews": 0,
    "averagePositivePercentage": null,
    "weightedPositivePercentage": null,
    "mostReviewedGame": null,
    "mostRecentRelease": null,
    "firstRelease": null,
    "technologyCount": 0,
    "engineCount": 0,
    "engines": []
  },
  "sources": [
    {
      "type": "wikidata",
      "url": "https://www.wikidata.org/wiki/Q266224",
      "retrievedAt": "2026-10-22"
    }
  ],
  "lastUpdated": "2026-10-22T10:16:02.975Z"
}
