{
  "id": "matt2",
  "name": "Matt2",
  "aliases": [],
  "roles": [
    "developer"
  ],
  "description": {
    "source": null,
    "custom": null
  },
  "website": null,
  "socialLinks": {},
  "location": {
    "headquarters": null,
    "country": null,
    "countryName": null
  },
  "founded": null,
  "foundedDate": null,
  "ownership": {
    "status": "unknown",
    "parentCompany": null,
    "parentCompanyName": null,
    "notes": null
  },
  "externalIds": {},
  "logo": null,
  "classification": {
    "include": false,
    "category": "unclassified",
    "notes": ""
  },
  "games": {
    "developed": [
      "lushfoil-photography-sim"
    ],
    "published": []
  },
  "statistics": {
    "gameCount": 1,
    "developedCount": 1,
    "publishedCount": 0,
    "totalSteamReviews": 1910,
    "averagePositivePercentage": 91.6,
    "weightedPositivePercentage": 91.6,
    "mostReviewedGame": "lushfoil-photography-sim",
    "mostRecentRelease": "lushfoil-photography-sim",
    "firstRelease": "lushfoil-photography-sim",
    "technologyCount": 1,
    "engineCount": 1,
    "engines": [
      "unreal-engine"
    ]
  },
  "sources": [],
  "lastUpdated": "2026-09-30T09:34:48.857Z"
}
