{
  "id": "iron-gate-ab",
  "name": "Iron Gate Studio",
  "aliases": [
    "Iron Gate AB"
  ],
  "roles": [
    "developer"
  ],
  "description": {
    "source": {
      "text": "Swedish game developer",
      "license": "cc0",
      "source": {
        "type": "wikidata",
        "url": "https://www.wikidata.org/wiki/Q105725001",
        "retrievedAt": "2026-10-29"
      }
    },
    "custom": null
  },
  "website": "https://irongatestudio.se/",
  "socialLinks": {},
  "location": {
    "headquarters": null,
    "country": "SE",
    "countryName": "Sweden"
  },
  "founded": 2019,
  "foundedDate": "2019-04",
  "ownership": {
    "status": "subsidiary",
    "parentCompany": "coffee-stain-studios",
    "parentCompanyName": "Coffee Stain Studios",
    "notes": null
  },
  "externalIds": {
    "wikidata": "Q105725001"
  },
  "logo": null,
  "classification": {
    "include": false,
    "category": "unclassified",
    "notes": ""
  },
  "games": {
    "developed": [
      "valheim"
    ],
    "published": []
  },
  "statistics": {
    "gameCount": 1,
    "developedCount": 1,
    "publishedCount": 0,
    "totalSteamReviews": 563095,
    "averagePositivePercentage": 93.4,
    "weightedPositivePercentage": 93.4,
    "mostReviewedGame": "valheim",
    "mostRecentRelease": "valheim",
    "firstRelease": "valheim",
    "technologyCount": 1,
    "engineCount": 1,
    "engines": [
      "unity"
    ]
  },
  "sources": [
    {
      "type": "wikidata",
      "url": "https://www.wikidata.org/wiki/Q105725001",
      "retrievedAt": "2026-10-29"
    }
  ],
  "lastUpdated": "2026-10-29T11:34:05.542Z"
}
