{
  "id": "navegante",
  "name": "Navegante",
  "aliases": [],
  "roles": [
    "developer"
  ],
  "description": {
    "source": null,
    "custom": null
  },
  "website": null,
  "socialLinks": {},
  "location": {
    "headquarters": null,
    "country": null,
    "countryName": null
  },
  "founded": null,
  "foundedDate": null,
  "ownership": {
    "status": "unknown",
    "parentCompany": null,
    "parentCompanyName": null,
    "notes": null
  },
  "externalIds": {},
  "logo": null,
  "classification": {
    "include": false,
    "category": "unclassified",
    "notes": ""
  },
  "games": {
    "developed": [
      "greak-2-alliance-of-the-storms",
      "greak-memories-of-azur"
    ],
    "published": []
  },
  "statistics": {
    "gameCount": 2,
    "developedCount": 2,
    "publishedCount": 0,
    "totalSteamReviews": 1570,
    "averagePositivePercentage": 78.2,
    "weightedPositivePercentage": 78.2,
    "mostReviewedGame": "greak-memories-of-azur",
    "mostRecentRelease": "greak-memories-of-azur",
    "firstRelease": "greak-memories-of-azur",
    "technologyCount": 0,
    "engineCount": 0,
    "engines": []
  },
  "sources": [],
  "lastUpdated": "2026-09-30T09:34:48.857Z"
}
