{
  "id": "beethoven-and-dinosaur",
  "name": "Beethoven and Dinosaur",
  "aliases": [
    "Beethoven & Dinosaur",
    "Beethoven & Dinosaur PTY Ltd"
  ],
  "roles": [
    "developer"
  ],
  "description": {
    "source": {
      "text": "video game developer",
      "license": "cc0",
      "source": {
        "type": "wikidata",
        "url": "https://www.wikidata.org/wiki/Q108472693",
        "retrievedAt": "2026-10-15"
      }
    },
    "custom": null
  },
  "website": "http://bnd.studio/",
  "socialLinks": {},
  "location": {
    "headquarters": null,
    "country": "AU",
    "countryName": "Australia"
  },
  "founded": 2017,
  "foundedDate": "2017-01-10",
  "ownership": {
    "status": "unknown",
    "parentCompany": null,
    "parentCompanyName": null,
    "notes": null
  },
  "externalIds": {
    "wikidata": "Q108472693"
  },
  "logo": null,
  "classification": {
    "include": false,
    "category": "unclassified",
    "notes": ""
  },
  "games": {
    "developed": [
      "mixtape",
      "the-artful-escape"
    ],
    "published": []
  },
  "statistics": {
    "gameCount": 2,
    "developedCount": 2,
    "publishedCount": 0,
    "totalSteamReviews": 10774,
    "averagePositivePercentage": 89.9,
    "weightedPositivePercentage": 88.7,
    "mostReviewedGame": "mixtape",
    "mostRecentRelease": "mixtape",
    "firstRelease": "the-artful-escape",
    "technologyCount": 0,
    "engineCount": 0,
    "engines": []
  },
  "sources": [
    {
      "type": "wikidata",
      "url": "https://www.wikidata.org/wiki/Q108472693",
      "retrievedAt": "2026-10-15"
    }
  ],
  "lastUpdated": "2026-10-15T09:59:55.142Z"
}
