{
  "id": "motion-twin",
  "name": "Motion Twin",
  "aliases": [],
  "roles": [
    "developer",
    "publisher"
  ],
  "description": {
    "source": {
      "text": "French video game developer and publisher",
      "license": "cc0",
      "source": {
        "type": "wikidata",
        "url": "https://www.wikidata.org/wiki/Q3325177",
        "retrievedAt": "2026-10-11"
      }
    },
    "custom": null
  },
  "website": "http://www.motion-twin.com",
  "socialLinks": {
    "x": "https://x.com/motiontwin"
  },
  "location": {
    "headquarters": "Bordeaux",
    "country": "FR",
    "countryName": "France"
  },
  "founded": 2001,
  "foundedDate": "2001-08-06",
  "ownership": {
    "status": "unknown",
    "parentCompany": null,
    "parentCompanyName": null,
    "notes": null
  },
  "externalIds": {
    "wikidata": "Q3325177"
  },
  "logo": null,
  "classification": {
    "include": true,
    "category": "independent",
    "notes": "Worker cooperative based in Bordeaux."
  },
  "games": {
    "developed": [
      "alphabounce",
      "dead-cells",
      "dead-cells-fatal-falls",
      "dead-cells-the-bad-seed",
      "dead-cells-the-queen-and-the-sea",
      "die2nite",
      "la-brute",
      "mush",
      "my-brute",
      "windblown"
    ],
    "published": [
      "dead-cells",
      "dead-cells-fatal-falls",
      "dead-cells-the-bad-seed",
      "dead-cells-the-queen-and-the-sea",
      "windblown"
    ]
  },
  "statistics": {
    "gameCount": 10,
    "developedCount": 10,
    "publishedCount": 5,
    "totalSteamReviews": 196645,
    "averagePositivePercentage": 92.4,
    "weightedPositivePercentage": 96.5,
    "mostReviewedGame": "dead-cells",
    "mostRecentRelease": "windblown",
    "firstRelease": "la-brute",
    "technologyCount": 3,
    "engineCount": 2,
    "engines": [
      "adobe-flash",
      "heaps"
    ]
  },
  "sources": [
    {
      "type": "wikidata",
      "url": "https://www.wikidata.org/wiki/Q3325177",
      "retrievedAt": "2026-10-11"
    },
    {
      "type": "manual"
    }
  ],
  "lastUpdated": "2026-10-11T11:26:22.704Z"
}
