{
  "id": "localthunk",
  "name": "LocalThunk",
  "aliases": [],
  "roles": [
    "developer"
  ],
  "description": {
    "source": {
      "text": "Canadian video game developer",
      "license": "cc0",
      "source": {
        "type": "wikidata",
        "url": "https://www.wikidata.org/wiki/Q125503065",
        "retrievedAt": "2026-10-11"
      }
    },
    "custom": null
  },
  "website": "https://localthunk.com",
  "socialLinks": {},
  "location": {
    "headquarters": null,
    "country": "CA",
    "countryName": "Canada"
  },
  "founded": null,
  "foundedDate": null,
  "ownership": {
    "status": "unknown",
    "parentCompany": null,
    "parentCompanyName": null,
    "notes": null
  },
  "externalIds": {
    "wikidata": "Q125503065"
  },
  "logo": null,
  "classification": {
    "include": false,
    "category": "unclassified",
    "notes": ""
  },
  "games": {
    "developed": [
      "balatro"
    ],
    "published": []
  },
  "statistics": {
    "gameCount": 1,
    "developedCount": 1,
    "publishedCount": 0,
    "totalSteamReviews": 199816,
    "averagePositivePercentage": 97.8,
    "weightedPositivePercentage": 97.8,
    "mostReviewedGame": "balatro",
    "mostRecentRelease": "balatro",
    "firstRelease": "balatro",
    "technologyCount": 1,
    "engineCount": 1,
    "engines": [
      "love2d"
    ]
  },
  "sources": [
    {
      "type": "wikidata",
      "url": "https://www.wikidata.org/wiki/Q125503065",
      "retrievedAt": "2026-10-11"
    }
  ],
  "lastUpdated": "2026-10-11T11:26:22.704Z"
}
