{
  "id": "screen-burn",
  "name": "Screen Burn",
  "aliases": [],
  "roles": [
    "developer"
  ],
  "description": {
    "source": {
      "text": "British video game developer",
      "license": "cc0",
      "source": {
        "type": "wikidata",
        "url": "https://www.wikidata.org/wiki/Q62604390",
        "retrievedAt": "2026-10-12"
      }
    },
    "custom": null
  },
  "website": "https://screenburn.com",
  "socialLinks": {
    "x": "https://x.com/_nocode"
  },
  "location": {
    "headquarters": "Glasgow",
    "country": "GB",
    "countryName": "United Kingdom"
  },
  "founded": 2015,
  "foundedDate": "2015",
  "ownership": {
    "status": "unknown",
    "parentCompany": null,
    "parentCompanyName": null,
    "notes": null
  },
  "externalIds": {
    "wikidata": "Q62604390",
    "igdb": "no-code"
  },
  "logo": null,
  "classification": {
    "include": false,
    "category": "unclassified",
    "notes": ""
  },
  "games": {
    "developed": [
      "observation",
      "silent-hill-townfall",
      "stories-untold"
    ],
    "published": []
  },
  "statistics": {
    "gameCount": 3,
    "developedCount": 3,
    "publishedCount": 0,
    "totalSteamReviews": 16723,
    "averagePositivePercentage": 77.9,
    "weightedPositivePercentage": 77.7,
    "mostReviewedGame": "silent-hill-townfall",
    "mostRecentRelease": "silent-hill-townfall",
    "firstRelease": "stories-untold",
    "technologyCount": 2,
    "engineCount": 2,
    "engines": [
      "unity",
      "unreal-engine"
    ]
  },
  "sources": [
    {
      "type": "wikidata",
      "url": "https://www.wikidata.org/wiki/Q62604390",
      "retrievedAt": "2026-10-12"
    }
  ],
  "lastUpdated": "2026-10-12T13:13:34.690Z"
}
