{
  "id": "ambertail-games",
  "name": "Ambertail Games",
  "aliases": [],
  "roles": [
    "developer"
  ],
  "description": {
    "source": null,
    "custom": null
  },
  "website": null,
  "socialLinks": {},
  "location": {
    "headquarters": null,
    "country": null,
    "countryName": null
  },
  "founded": null,
  "foundedDate": null,
  "ownership": {
    "status": "unknown",
    "parentCompany": null,
    "parentCompanyName": null,
    "notes": null
  },
  "externalIds": {},
  "logo": null,
  "classification": {
    "include": false,
    "category": "unclassified",
    "notes": ""
  },
  "games": {
    "developed": [
      "amber-isle"
    ],
    "published": []
  },
  "statistics": {
    "gameCount": 1,
    "developedCount": 1,
    "publishedCount": 0,
    "totalSteamReviews": 2134,
    "averagePositivePercentage": 82.3,
    "weightedPositivePercentage": 82.3,
    "mostReviewedGame": "amber-isle",
    "mostRecentRelease": "amber-isle",
    "firstRelease": "amber-isle",
    "technologyCount": 0,
    "engineCount": 0,
    "engines": []
  },
  "sources": [],
  "lastUpdated": "2026-09-30T09:34:48.857Z"
}
