{
  "id": "glass-revolver",
  "name": "Glass Revolver",
  "aliases": [],
  "roles": [
    "developer"
  ],
  "description": {
    "source": null,
    "custom": null
  },
  "website": null,
  "socialLinks": {},
  "location": {
    "headquarters": null,
    "country": null,
    "countryName": null
  },
  "founded": null,
  "foundedDate": null,
  "ownership": {
    "status": "unknown",
    "parentCompany": null,
    "parentCompanyName": null,
    "notes": null
  },
  "externalIds": {},
  "logo": null,
  "classification": {
    "include": false,
    "category": "unclassified",
    "notes": ""
  },
  "games": {
    "developed": [
      "we-kill-monsters"
    ],
    "published": []
  },
  "statistics": {
    "gameCount": 1,
    "developedCount": 1,
    "publishedCount": 0,
    "totalSteamReviews": 0,
    "averagePositivePercentage": null,
    "weightedPositivePercentage": null,
    "mostReviewedGame": null,
    "mostRecentRelease": null,
    "firstRelease": null,
    "technologyCount": 0,
    "engineCount": 0,
    "engines": []
  },
  "sources": [],
  "lastUpdated": "2026-09-30T09:34:48.857Z"
}
